recipe_name,memo,image_id,user_id,admin_id
豚バラ肉のローストポーク,ちょっとした下ごしらえのあとは、オーブン任せ！日持ちします,,,1
某家のオリジナルカレー,本サービス製作者の実家で生み出された本格アレンジレシピ！,,,1
じゃがいもと玉ねぎのチヂミ,ピリ辛タレでお酒が進みます！,,,1
トマトとモッツァレラのカプレーゼ,オリーブオイルでさっぱりと,,,1
濃厚本格カルボナーラ,生クリーム入りで濃厚,,,1
キャベツのペペロンチーノ,赤唐辛子でピリッと。大人の味付け,,,1
菜の花ジェノベーゼのパスタ,春の苦味を味わうパスタ,,,1
なすのトマトソースパスタ,ナスが主役のオーソドックスなパスタです,,,1
定番ガパオライス,バジルの代わりに大葉を使って定番メニューを！,,,1
イタリアン野菜ソース,某イタリアンチェーン店の定番ソースを再現,,,1
鮭とアスパラのアーリオオーリオ,簡単なのに手抜きに見えない！シンプルな調味料でさくっと,,,1
ツナと人参の胡麻和え,お弁当の彩りに！簡単レシピ,,,1
夏野菜の揚げ浸し,白だしで本格的な味わいに,,,1
王道ガトーショコラ,ビターチョコレートで大人の味わいに,,,